{
  "seq": 0,
  "unread": 0,
  "items": [],
  "connections": [
    {
      "integrationId": "int_b71e02",
      "provider": "github",
      "label": "haxzie/notch-metrics",
      "unread": 0,
      "total": 0
    }
  ],
  "hasMore": false,
  "oldestSeq": null,
  "truncated": false,
  "pollAfterSeconds": 3600
}
